{"$schema":"https://json-schema.org/draft/2020-12/schema","$id":"https://christus-rex.github.io/temple-of-maat/research/pair-authority-name-migration.v1.schema.json","title":"Temple of Ma'at Pair Authority Third Name Migration v1","type":"object","additionalProperties":false,"required":["schema","version","updated","privacy","sourceId","legacyMethod","preferredMethod","sourceLocators","policy","summary","records"],"properties":{"schema":{"const":"temple-of-maat/pair-authority-name-migration-v1"},"version":{"const":"1.0.0"},"updated":{"type":"string","pattern":"^\\d{4}-\\d{2}-\\d{2}$"},"privacy":{"const":"public-canonical-only"},"sourceId":{"const":"effective-temple-canon-v1"},"legacyMethod":{"const":"temple-third-name-v1"},"preferredMethod":{"const":"temple-third-name-refined-v2"},"sourceLocators":{"type":"object","additionalProperties":false,"required":["legacy","preferred"],"properties":{"legacy":{"type":"string","minLength":20},"preferred":{"type":"string","minLength":20}}},"policy":{"type":"object","additionalProperties":false,"required":["futureDisplayPreference","legacyAliasRetention","implementationBoundary","pairingInvariant"],"properties":{"futureDisplayPreference":{"type":"string","minLength":20},"legacyAliasRetention":{"type":"string","minLength":20},"implementationBoundary":{"type":"string","minLength":20},"pairingInvariant":{"type":"string","minLength":20}}},"summary":{"type":"object","additionalProperties":false,"required":["recordCount","substantiveSpellingChanges","sameIgnoringCase","implementationMigrated"],"properties":{"recordCount":{"const":72},"substantiveSpellingChanges":{"const":44},"sameIgnoringCase":{"const":28},"implementationMigrated":{"const":false}}},"records":{"type":"array","minItems":72,"maxItems":72,"items":{"$ref":"#/$defs/record"}}},"$defs":{"record":{"type":"object","additionalProperties":false,"required":["recordId","pairNumber","angel","daemon","legacyThirdName","preferredRefinedThirdName","sameIgnoringCase","migrationStatus"],"properties":{"recordId":{"type":"string","pattern":"^pair\\.[0-9]{2}$"},"pairNumber":{"type":"integer","minimum":1,"maximum":72},"angel":{"type":"string","minLength":1},"daemon":{"type":"string","minLength":1},"legacyThirdName":{"type":"string","minLength":1},"preferredRefinedThirdName":{"type":"string","minLength":1},"sameIgnoringCase":{"type":"boolean"},"migrationStatus":{"enum":["ALIAS_EQUIVALENT","PENDING_IMPLEMENTATION_MIGRATION"]}}}}}