{"schema":"temple-of-maat/pair-authority-name-migration-v1","version":"1.0.0","updated":"2026-08-16","privacy":"public-canonical-only","sourceId":"effective-temple-canon-v1","legacyMethod":"temple-third-name-v1","preferredMethod":"temple-third-name-refined-v2","sourceLocators":{"legacy":"AMENDMENT I — CODEX-DERIVED RESULTING IDENTITIES · 72 TEMPLE-DERIVED THIRD / WHOLESOME NAMES","preferred":"AMENDMENT II — EUPHONIC REFINEMENT OF THE 72 THIRD NAMES · REFINED CANONICAL NAME REGISTER"},"policy":{"futureDisplayPreference":"Amendment II refined forms are preferred for future Temple spoken and display naming.","legacyAliasRetention":"Amendment I transparent-fusion forms remain preserved as legacy aliases for provenance and existing chamber text.","implementationBoundary":"This registry does not rename the currently deployed chamber implementation. Migration requires an explicit versioned release.","pairingInvariant":"Refinement changes naming only; it does not change source pairings, gematria results, chamber constitutions, offices, laws, or recurrence doctrine."},"summary":{"recordCount":72,"substantiveSpellingChanges":44,"sameIgnoringCase":28,"implementationMigrated":false},"records":[{"recordId":"pair.01","pairNumber":1,"angel":"Vehuiah","daemon":"Bifrons","legacyThirdName":"Bifruiah","preferredRefinedThirdName":"BIFRUIAH","sameIgnoringCase":true,"migrationStatus":"ALIAS_EQUIVALENT"},{"recordId":"pair.02","pairNumber":2,"angel":"Jeliel","daemon":"Orias","legacyThirdName":"Orialiel","preferredRefinedThirdName":"ORIALIEL","sameIgnoringCase":true,"migrationStatus":"ALIAS_EQUIVALENT"},{"recordId":"pair.03","pairNumber":3,"angel":"Sitael","daemon":"Andras","legacyThirdName":"Andritael","preferredRefinedThirdName":"ANDRASITAEL","sameIgnoringCase":false,"migrationStatus":"PENDING_IMPLEMENTATION_MIGRATION"},{"recordId":"pair.04","pairNumber":4,"angel":"Elemiah","daemon":"Berith","legacyThirdName":"Berelmiah","preferredRefinedThirdName":"BEREMIAH","sameIgnoringCase":false,"migrationStatus":"PENDING_IMPLEMENTATION_MIGRATION"},{"recordId":"pair.05","pairNumber":5,"angel":"Mahasiah","daemon":"Gamigin","legacyThirdName":"Gamiasiah","preferredRefinedThirdName":"GAMASIAH","sameIgnoringCase":false,"migrationStatus":"PENDING_IMPLEMENTATION_MIGRATION"},{"recordId":"pair.06","pairNumber":6,"angel":"Lelahel","daemon":"Vapula","legacyThirdName":"Vapulahel","preferredRefinedThirdName":"VAPULAHEL","sameIgnoringCase":true,"migrationStatus":"ALIAS_EQUIVALENT"},{"recordId":"pair.07","pairNumber":7,"angel":"Achaiah","daemon":"Alloces","legacyThirdName":"Allochiah","preferredRefinedThirdName":"ALLACHIAH","sameIgnoringCase":false,"migrationStatus":"PENDING_IMPLEMENTATION_MIGRATION"},{"recordId":"pair.08","pairNumber":8,"angel":"Cahetel","daemon":"Bathin","legacyThirdName":"Bathietel","preferredRefinedThirdName":"BATHIETEL","sameIgnoringCase":true,"migrationStatus":"ALIAS_EQUIVALENT"},{"recordId":"pair.09","pairNumber":9,"angel":"Haziel","daemon":"Beleth","legacyThirdName":"Belehaziel","preferredRefinedThirdName":"BELHAZIEL","sameIgnoringCase":false,"migrationStatus":"PENDING_IMPLEMENTATION_MIGRATION"},{"recordId":"pair.10","pairNumber":10,"angel":"Aladiah","daemon":"Bathin","legacyThirdName":"Bathiadiah","preferredRefinedThirdName":"BATHADIAH","sameIgnoringCase":false,"migrationStatus":"PENDING_IMPLEMENTATION_MIGRATION"},{"recordId":"pair.11","pairNumber":11,"angel":"Lauviah","daemon":"Valefar","legacyThirdName":"Valelauviah","preferredRefinedThirdName":"VALAUVIAH","sameIgnoringCase":false,"migrationStatus":"PENDING_IMPLEMENTATION_MIGRATION"},{"recordId":"pair.12","pairNumber":12,"angel":"Hahaiah","daemon":"Dantalion","legacyThirdName":"Dantahaiah","preferredRefinedThirdName":"DANTAHAIAH","sameIgnoringCase":true,"migrationStatus":"ALIAS_EQUIVALENT"},{"recordId":"pair.13","pairNumber":13,"angel":"Iezalel","daemon":"Focalor","legacyThirdName":"Focazalel","preferredRefinedThirdName":"FOCAZALEL","sameIgnoringCase":true,"migrationStatus":"ALIAS_EQUIVALENT"},{"recordId":"pair.14","pairNumber":14,"angel":"Mebahel","daemon":"Vapula","legacyThirdName":"Vapubahel","preferredRefinedThirdName":"VAPUBAHEL","sameIgnoringCase":true,"migrationStatus":"ALIAS_EQUIVALENT"},{"recordId":"pair.15","pairNumber":15,"angel":"Hariel","daemon":"Berith","legacyThirdName":"Berihariel","preferredRefinedThirdName":"BERIHARIEL","sameIgnoringCase":true,"migrationStatus":"ALIAS_EQUIVALENT"},{"recordId":"pair.16","pairNumber":16,"angel":"Hekamiah","daemon":"Haagenti","legacyThirdName":"Haagakamiah","preferredRefinedThirdName":"HAEKAMIAH","sameIgnoringCase":false,"migrationStatus":"PENDING_IMPLEMENTATION_MIGRATION"},{"recordId":"pair.17","pairNumber":17,"angel":"Lauviah","daemon":"Valefar","legacyThirdName":"Valelauviah","preferredRefinedThirdName":"VALAUVIAH","sameIgnoringCase":false,"migrationStatus":"PENDING_IMPLEMENTATION_MIGRATION"},{"recordId":"pair.18","pairNumber":18,"angel":"Caliel","daemon":"Agares","legacyThirdName":"Agacaliel","preferredRefinedThirdName":"AGACALIEL","sameIgnoringCase":true,"migrationStatus":"ALIAS_EQUIVALENT"},{"recordId":"pair.19","pairNumber":19,"angel":"Leuviah","daemon":"Asmoday","legacyThirdName":"Asmoleuviah","preferredRefinedThirdName":"ASMODEUVIAH","sameIgnoringCase":false,"migrationStatus":"PENDING_IMPLEMENTATION_MIGRATION"},{"recordId":"pair.20","pairNumber":20,"angel":"Pahaliah","daemon":"Haagenti","legacyThirdName":"Haagpahaliah","preferredRefinedThirdName":"HAEPAHALIAH","sameIgnoringCase":false,"migrationStatus":"PENDING_IMPLEMENTATION_MIGRATION"},{"recordId":"pair.21","pairNumber":21,"angel":"Nelkhael","daemon":"Paimon","legacyThirdName":"Paimelkhael","preferredRefinedThirdName":"PAIMELKHAEL","sameIgnoringCase":true,"migrationStatus":"ALIAS_EQUIVALENT"},{"recordId":"pair.22","pairNumber":22,"angel":"Yeiayel","daemon":"Vapula","legacyThirdName":"Vapuyeiayel","preferredRefinedThirdName":"VAPUYEL","sameIgnoringCase":false,"migrationStatus":"PENDING_IMPLEMENTATION_MIGRATION"},{"recordId":"pair.23","pairNumber":23,"angel":"Melahel","daemon":"Halphas","legacyThirdName":"Halmelahel","preferredRefinedThirdName":"HALMELAHEL","sameIgnoringCase":true,"migrationStatus":"ALIAS_EQUIVALENT"},{"recordId":"pair.24","pairNumber":24,"angel":"Hahuiah","daemon":"Halphas","legacyThirdName":"Halhahuiah","preferredRefinedThirdName":"HALHUIAH","sameIgnoringCase":false,"migrationStatus":"PENDING_IMPLEMENTATION_MIGRATION"},{"recordId":"pair.25","pairNumber":25,"angel":"Nithaiah","daemon":"Focalor","legacyThirdName":"Focanithaiah","preferredRefinedThirdName":"FOCANITHAIAH","sameIgnoringCase":true,"migrationStatus":"ALIAS_EQUIVALENT"},{"recordId":"pair.26","pairNumber":26,"angel":"Haaiah","daemon":"Vapula","legacyThirdName":"Vapuhaaiah","preferredRefinedThirdName":"VAPUHAIAH","sameIgnoringCase":false,"migrationStatus":"PENDING_IMPLEMENTATION_MIGRATION"},{"recordId":"pair.27","pairNumber":27,"angel":"Yerathel","daemon":"Alloces","legacyThirdName":"Alloyerathel","preferredRefinedThirdName":"ALLOCERATHEL","sameIgnoringCase":false,"migrationStatus":"PENDING_IMPLEMENTATION_MIGRATION"},{"recordId":"pair.28","pairNumber":28,"angel":"Seheiah","daemon":"Vapula","legacyThirdName":"Vapuseheiah","preferredRefinedThirdName":"VAPUSEIAH","sameIgnoringCase":false,"migrationStatus":"PENDING_IMPLEMENTATION_MIGRATION"},{"recordId":"pair.29","pairNumber":29,"angel":"Reyiel","daemon":"Gremory","legacyThirdName":"Gremoreyiel","preferredRefinedThirdName":"GREMORIEL","sameIgnoringCase":false,"migrationStatus":"PENDING_IMPLEMENTATION_MIGRATION"},{"recordId":"pair.30","pairNumber":30,"angel":"Omael","daemon":"Buer","legacyThirdName":"Buromael","preferredRefinedThirdName":"BUROMAEL","sameIgnoringCase":true,"migrationStatus":"ALIAS_EQUIVALENT"},{"recordId":"pair.31","pairNumber":31,"angel":"Lecabel","daemon":"Alloces","legacyThirdName":"Allolecabel","preferredRefinedThirdName":"ALLOCABEL","sameIgnoringCase":false,"migrationStatus":"PENDING_IMPLEMENTATION_MIGRATION"},{"recordId":"pair.32","pairNumber":32,"angel":"Vasariah","daemon":"Focalor","legacyThirdName":"Focavasariah","preferredRefinedThirdName":"FOCAVASARIAH","sameIgnoringCase":true,"migrationStatus":"ALIAS_EQUIVALENT"},{"recordId":"pair.33","pairNumber":33,"angel":"Yehuiah","daemon":"Paimon","legacyThirdName":"Paiyehuiah","preferredRefinedThirdName":"PAIMOHUIAH","sameIgnoringCase":false,"migrationStatus":"PENDING_IMPLEMENTATION_MIGRATION"},{"recordId":"pair.34","pairNumber":34,"angel":"Lehahiah","daemon":"Marchosias","legacyThirdName":"Marcholehahiah","preferredRefinedThirdName":"MARCHAHIAH","sameIgnoringCase":false,"migrationStatus":"PENDING_IMPLEMENTATION_MIGRATION"},{"recordId":"pair.35","pairNumber":35,"angel":"Chavakiah","daemon":"Glasya Labolas","legacyThirdName":"Glasyavakiah","preferredRefinedThirdName":"GLASYAVAKIAH","sameIgnoringCase":true,"migrationStatus":"ALIAS_EQUIVALENT"},{"recordId":"pair.36","pairNumber":36,"angel":"Menadel","daemon":"Bathin","legacyThirdName":"Bathimenadel","preferredRefinedThirdName":"BATHINADEL","sameIgnoringCase":false,"migrationStatus":"PENDING_IMPLEMENTATION_MIGRATION"},{"recordId":"pair.37","pairNumber":37,"angel":"Aniel","daemon":"Camio","legacyThirdName":"Camianiel","preferredRefinedThirdName":"CAMIANIEL","sameIgnoringCase":true,"migrationStatus":"ALIAS_EQUIVALENT"},{"recordId":"pair.38","pairNumber":38,"angel":"Haamiah","daemon":"Belial","legacyThirdName":"Belhaamiah","preferredRefinedThirdName":"BELIAMIAH","sameIgnoringCase":false,"migrationStatus":"PENDING_IMPLEMENTATION_MIGRATION"},{"recordId":"pair.39","pairNumber":39,"angel":"Rehael","daemon":"Gusoin","legacyThirdName":"Gusorehael","preferredRefinedThirdName":"GUSOREHAEL","sameIgnoringCase":true,"migrationStatus":"ALIAS_EQUIVALENT"},{"recordId":"pair.40","pairNumber":40,"angel":"Yeiazel","daemon":"Bifrons","legacyThirdName":"Bifroyeiazel","preferredRefinedThirdName":"BIFRIAZEL","sameIgnoringCase":false,"migrationStatus":"PENDING_IMPLEMENTATION_MIGRATION"},{"recordId":"pair.41","pairNumber":41,"angel":"Hahahel","daemon":"Beleth","lega